{
  "$schema": "http://json-schema.org/draft-07/schema#",
  "title": "Governance Policy",
  "type": "object",
  "additionalProperties": false,
  "required": [
    "policy_id",
    "name",
    "version",
    "owner",
    "created_at",
    "updated_at",
    "levels",
    "escalation_path"
  ],
  "properties": {
    "policy_id": { "type": "string", "minLength": 1 },
    "name": { "type": "string", "minLength": 1 },
    "version": { "type": "string", "minLength": 1 },
    "owner": { "type": "string", "minLength": 1 },
    "created_at": { "type": "string", "format": "date-time" },
    "updated_at": { "type": "string", "format": "date-time" },
    "levels": {
      "type": "array",
      "minItems": 4,
      "items": {
        "type": "object",
        "additionalProperties": false,
        "required": [
          "level",
          "name",
          "description",
          "allowed_actions",
          "requires_human_review",
          "requires_run_logging",
          "restricted_data"
        ],
        "properties": {
          "level": {
            "type": "string",
            "enum": ["A0", "A1", "A2", "A3"]
          },
          "name": { "type": "string", "minLength": 1 },
          "description": { "type": "string", "minLength": 1 },
          "allowed_actions": {
            "type": "array",
            "items": { "type": "string" }
          },
          "requires_human_review": { "type": "boolean" },
          "requires_run_logging": { "type": "boolean" },
          "restricted_data": {
            "type": "array",
            "items": { "type": "string" }
          }
        }
      }
    },
    "escalation_path": {
      "type": "array",
      "minItems": 4,
      "items": {
        "type": "string",
        "enum": ["A0", "A1", "A2", "A3"]
      }
    }
  }
}
